{"adapterId":"generic_web","capabilities":["browser.read"],"requiredEvidence":["dom","screenshot"],"status":"simulation_ready","mission":{"schemaVersion":1,"missionId":"fixture","taskId":"fixture","deadlineMs":3000,"evidenceDir":"fixture-evidence","sessionStatePath":"fixture-session","steps":[{"id":"goto","kind":"goto","url":"http://127.0.0.1:1234","timeoutMs":1000,"replaySafe":true},{"id":"observe","kind":"observe","timeoutMs":1000,"replaySafe":true}]}}
